PAPER_ID,VENUE,YEAR,FULL_NAME,TITLE,ABSTRACT,TYPE
37,TSE,2022,TSE2022,GPT2SP: A Transformer-Based Agile Story Point Estimation Approach,"Story point estimation is a task to estimate the overall effort required to fully implement a product backlog item. Various estimation approaches (e.g., Planning Poker, Analogy, and expert judgment) are widely-used, yet they are still inaccurate and may be subjective, leading to ineffective sprint planning. Recent work proposed Deep-SE, a deep learning-based Agile story point estimation approach, yet it is still inaccurate, not transferable to other projects, and not interpretable. In this paper, we propose GPT2SP, a Transformer-based Agile Story Point Estimation approach. Our GPT2SP employs a GPT-2 pre-trained language model with a GPT-2 Transformer-based architecture, allowing our GPT2SP models to better capture the relationship among words while considering the context surrounding a given word and its position in the sequence and be transferable to other projects, while being interpretable. Through an extensive evaluation on 23,313 issues that span across 16 open-source software projects with 10 existing baseline approaches for within- and cross-project scenarios, our results show that our GPT2SP approach achieves a median MAE of 1.16, which is (1) 34%-57% more accurate than existing baseline approaches for within-project estimations; (2) 39%-49% more accurate than existing baseline approaches for cross-project estimations. The ablation study also shows that the GPT-2 architecture used in our approach substantially improves Deep-SE by 6%-47%, highlighting the significant advancement of the AI for Agile story point estimation. Finally, we develop a proof-of-concept tool to help practitioners better understand the most important words that contributed to the story point estimation of the given issue with the best supporting examples from past estimates. Our survey study with 16 Agile practitioners shows that the story point estimation task is perceived as an extremely challenging task. In addition, our AI-based story point estimation with explanations is perceived as more useful and trustworthy than without explanations, highlighting the practical need of our Explainable AI-based story point estimation approach. IEEE",JOURNAL
39,TSE,2022,TSE2022,On the Effectiveness of Transfer&#x00A0;Learning for Code&#x00A0;Search,"The Transformer architecture and transfer learning have marked a quantum leap in natural language processing, improving the state of the art across a range of text-based tasks. This paper examines how these advancements can be applied to and improve code search. To this end, we pre-train a BERT-based model on combinations of natural language and source code data and fine-tune it on pairs of StackOverflow question titles and code answers. Our results show that the pre-trained models consistently outperform the models that were not pre-trained. In cases where the model was pre-trained on natural language and source code data, it also outperforms an information retrieval baseline based on Lucene. Also, we demonstrated that the combined use of an information retrieval-based approach followed by a Transformer leads to the best results overall, especially when searching into a large search pool. Transfer learning is particularly effective when much pre-training data is available and fine-tuning data is limited. We demonstrate that natural language processing models based on the Transformer architecture can be directly applied to source code analysis tasks, such as code search. With the development of Transformer models designed more specifically for dealing with source code data, we believe the results of source code analysis tasks can be further improved. Author",JOURNAL
40,TSE,2022,TSE2022,SeqTrans: Automatic Vulnerability Fix via Sequence to Sequence Learning,"Software vulnerabilities are now reported unprecedentedly due to the recent development of automated vulnerability hunting tools. However, fixing vulnerabilities still mainly depends on programmers' manual efforts. Developers need to deeply understand the vulnerability and affect the system's functions as little as possible. In this paper, with the advancement of Neural Machine Translation (NMT) techniques, we provide a novel approach called SeqTrans to exploit historical vulnerability fixes to provide suggestions and automatically fix the source code. To capture the contextual information around the vulnerable code, we propose to leverage data-flow dependencies to construct code sequences and feed them into the state-of-the-art transformer model. The fine-tuning strategy has been introduced to overcome the small sample size problem. We evaluate SeqTrans on a dataset containing 1,282 commits that fix 624 CVEs in 205 Java projects. Results show that the accuracy of SeqTrans outperforms the latest techniques and achieves 23.3% in statement-level fix and 25.3% in CVE-level fix. In the meantime, we look deep inside the result and observe that the NMT model performs very well in certain kinds of vulnerabilities like CWE-287 (Improper Authentication) and CWE-863 (Incorrect Authorization). IEEE",JOURNAL
41,TOSEM,2022,TOSEM2022,XCode: Towards Cross-Language Code Representation with Large-Scale Pre-Training,"Source code representation learning is the basis of applying artificial intelligence to many software engineering tasks such as code clone detection, algorithm classification, and code summarization. Recently, many works have tried to improve the performance of source code representation from various perspectives, e.g., introducing the structural information of programs into latent representation. However, when dealing with rapidly expanded unlabeled cross-language source code datasets from the Internet, there are still two issues. Firstly, deep learning models for many code-specific tasks still suffer from the lack of high-quality labels. Secondly, the structural differences among programming languages make it more difficult to process multiple languages in a single neural architecture.To address these issues, in this article, we propose a novel Cross-language Code representation with a large-scale pre-Training (XCode) method. Concretely, we propose to use several abstract syntax trees and ELMo-enhanced variational autoencoders to obtain multiple pre-Trained source code language models trained on about 1.5 million code snippets. To fully utilize the knowledge across programming languages, we further propose a Shared Encoder-Decoder (SED) architecture which uses the multi-Teacher single-student method to transfer knowledge from the aforementioned pre-Trained models to the distilled SED. The pre-Trained models and SED will cooperate to better represent the source code. For evaluation, we examine our approach on three typical downstream cross-language tasks, i.e., source code translation, code clone detection, and code-To-code search, on a real-world dataset composed of programming exercises with multiple solutions. Experimental results demonstrate the effectiveness of our proposed approach on cross-language code representations. Meanwhile, our approach performs significantly better than several code representation baselines on different downstream tasks in terms of multiple automatic evaluation metrics. © 2022 Copyright held by the owner/author(s). Publication rights licensed to ACM.",JOURNAL
42,TOSEM,2022,TOSEM2022,An Empirical Study of the Effectiveness of an Ensemble of Stand-Alone Sentiment Detection Tools for Software Engineering Datasets,"Sentiment analysis in software engineering (SE) has shown promise to analyze and support diverse development activities. Recently, several tools are proposed to detect sentiments in software artifacts. While the tools improve accuracy over off-The-shelf tools, recent research shows that their performance could still be unsatisfactory. A more accurate sentiment detector for SE can help reduce noise in analysis of software scenarios where sentiment analysis is required. Recently, combinations, i.e., hybrids of stand-Alone classifiers are found to offer better performance than the stand-Alone classifiers for fault detection. However, we are aware of no such approach for sentiment detection for software artifacts. We report the results of an empirical study that we conducted to determine the feasibility of developing an ensemble engine by combining the polarity labels of stand-Alone SE-specific sentiment detectors. Our study has two phases. In the first phase, we pick five SE-specific sentiment detection tools from two recently published papers by Lin et al. [29, 30], who first reported negative results with stand alone sentiment detectors and then proposed an improved SE-specific sentiment detector, POME [29]. We report the study results on 17,581 units (sentences/documents) coming from six currently available sentiment benchmarks for software engineering. We find that the existing tools can be complementary to each other in 85-95% of the cases, i.e., one is wrong but another is right. However, a majority voting-based ensemble of those tools fails to improve the accuracy of sentiment detection. We develop Sentisead, a supervised tool by combining the polarity labels and bag of words as features. Sentisead improves the performance (F1-score) of the individual tools by 4% (over Senti4SD [5])-100% (over POME [29]). The initial development of Sentisead occurred before we observed the use of deep learning models for SE-specific sentiment detection. In particular, recent papers show the superiority of advanced language-based pre-Trained transformer models (PTM) over rule-based and shallow learning models. Consequently, in a second phase, we compare and improve Sentisead infrastructure using the PTMs. We find that a Sentisead infrastructure with RoBERTa as the ensemble of the five stand-Alone rule-based and shallow learning SE-specific tools from Lin et al. [29, 30] offers the best F1-score of 0.805 across the six datasets, while a stand-Alone RoBERTa shows an F1-score of 0.801. © 2022 Association for Computing Machinery.",JOURNAL
43,JSS,2022,JSS2022,PRHAN: Automated Pull Request Description Generation Based on Hybrid Attention Network,"Descriptions of pull requests (PRs) are posted by developers for describing the modifications that they have made and the corresponding reasons in these PRs. Although PRs help developers improve the development efficiency, some developers usually ignore writing the descriptions for PRs. To alleviate the above problem, researchers generally utilize text summarization model to automatically generate descriptions for PRs. However, current RNN-based models still face the challenges such as low efficiency and out-of-vocabulary (OOV), which may influence the further performance improvement to their models. To break this bottleneck, we propose a novel model aiming at the above challenges, named PRHAN (Pull Requests Description Generation Based on Hybrid Attention Network). Specifically, the core of PRHAN is the hybrid attention network, which has faster execution efficiency than RNN-based model. Moreover, we address the OOV problem by the utilizing byte-pair encoding algorithm to build a vocabulary at the sub-word level. Such a vocabulary can represent the OOV words by combining sub-word units. To reduce the sensitivity of the model, we take a simple but effective method into the cross-entropy loss function, named label smoothing. We choose three baseline models, including LeadCM, Transformer and the state-of-the-art model built by Liu et al. and evaluate all the models on the open-source dataset through ROUGE, BLEU, and human evaluation. The experimental results demonstrate that PRHAN is more effective than baselines. Moreover, PRHAN can execute faster than the state-of-the-art model proposed by Liu et al. © 2021 Elsevier Inc.",JOURNAL
44,IST,2021,IST2021,Augmenting commit classification by using fine-grained source code changes and a pre-trained deep neural language model,"Context: Analyzing software maintenance activities is very helpful in ensuring cost-effective evolution and development activities. The categorization of commits into maintenance tasks supports practitioners in making decisions about resource allocation and managing technical debt. Objective: In this paper, we propose to use a pre-trained language neural model, namely BERT (Bidirectional Encoder Representations from Transformers) for the classification of commits into three categories of maintenance tasks — corrective, perfective and adaptive. The proposed commit classification approach will help the classifier better understand the context of each word in the commit message. Methods: We built a balanced dataset of 1793 labeled commits that we collected from publicly available datasets. We used several popular code change distillers to extract fine-grained code changes that we have incorporated into our dataset as additional features to BERT's word representation features. In our study, a deep neural network (DNN) classifier has been used as an additional layer to fine-tune the BERT model on the task of commit classification. Several models have been evaluated to come up with a deep analysis of the impact of code changes on the classification performance of each commit category. Results and conclusions: Experimental results have shown that the DNN model trained on BERT's word representations and Fixminer code changes (DNN@BERT+Fix_cc) provided the best performance and achieved 79.66% accuracy and a macro-average f1 score of 0.8. Comparison with the state-of-the-art model that combines keywords and code changes (RF@KW+CD_cc) has shown that our model achieved approximately 8% improvement in accuracy. Results have also shown that a DNN model using only BERT's word representation features achieved an improvement of 5% in accuracy compared to the RF@KW+CD_cc model. © 2021",JOURNAL
45,IST,2021,IST2021,ALBFL: A novel neural ranking model for software fault localization via combining static and dynamic features,"Context: Automatic software fault localization serves as a significant purpose in helping developers solve bugs efficiently. Existing approaches for software fault localization can be categorized into static methods and dynamic ones, which have improved the fault locating ability greatly by analyzing static features from the source code or tracking dynamic behaviors during the runtime respectively. However, the accuracy of fault localization is still unsatisfactory. Objective: To enhance the capability of detecting software faults with the statement granularity, this paper puts forward ALBFL, a novel neural ranking model that combines the static and dynamic features, which obtains excellent fault localization accuracy. Firstly, ALBFL learns the semantic features of the source code by a transformer encoder. Then, it exploits a self-attention layer to integrate those static features and dynamic features. Finally, those integrated features are fed into a LambdaRank model, which can list the suspicious statements in descending order by their ranked scores. Method: The experiments are conducted on an authoritative dataset (i.e., Defect4J), which includes 5 open-source projects, 357 faulty programs in total. We evaluate the effectiveness of ALBFL, effectiveness of combining features, effectiveness of model components and aggregation on method level. Result: The results reflect that ALBFL identifies triple more faulty statements than 11 traditional SBFL methods and outperforms 2 state-of-the-art approaches by on average 14% on ranking faults in the first position. Conclusions: To improve the precision of automatic software fault localization, ALBFL combines neural network ranking model equipped with the self-attention layer and the transformer encoder, which can take full use of various techniques to judge whether a code statement is fault-inducing or not. Moreover, the joint architecture of ALBFL is capable of training the integration of these features under various strategies so as to improve accuracy further. In the future, we plan to exploit more features so as to improve our method's efficiency and accuracy. © 2021",JOURNAL
46,IST,2022,IST2022,An empirical study of IoT security aspects at sentence-level in developer textual discussions,"Context: IoT is a rapidly emerging paradigm that now encompasses almost every aspect of our modern life. As such, ensuring the security of IoT devices is crucial. IoT devices can differ from traditional computing (e.g., low power, storage, computing), thereby the design and implementation of proper security measures can be challenging in IoT devices. We observed that IoT developers discuss their security-related challenges in developer forums like Stack Overflow (SO). However, we find that IoT security discussions can also be buried inside non-security discussions in SO. Objective: In this paper, we aim to understand the challenges IoT developers face while applying security practices and techniques to IoT devices. We have two goals: (1) Develop a model that can automatically find security-related IoT discussions in SO, and (2) Study the model output (i.e., the security discussions) to learn about IoT developer security-related challenges. Methods: First, we download all 53K posts from StackOverflow (SO) that contain discussions about various IoT devices, tools, and techniques. Second, we manually labeled 5,919 sentences from 53K posts as 1 or 0 (i.e., whether they contain a security aspect or not). Third, we then use this benchmark to investigate a suite of deep learning transformer models. The best performing model is called SecBot. Fourth, we apply SecBot on the entire 53K posts and find around 30K sentences labeled as security. Fifth, we apply topic modeling to the 30K security-related sentences labeled by SecBot. Then we label and categorize the topics. Sixth, we analyze the evolution of the topics in SO. Results: We found that (1) SecBot is based on the retraining of the deep learning model RoBERTa. SecBot offers the best F1-Score of .935, (2) there are six error categories in misclassified samples by SecBot. SecBot was mostly wrong when the keywords/contexts were ambiguous (e.g., ‘gateway’ can be a security gateway or a simple gateway), (3) there are 9 security topics grouped into three categories: Software, Hardware, and Network, and (4) the highest number of topics belongs to software security, followed by network security and hardware security. Conclusion: IoT researchers and vendors can use SecBot to collect and analyze security-related discussions from developer discussions in SO. The analysis of nine security-related topics can guide major IoT stakeholders like IoT Security Enthusiasts, Developers, Vendors, Educators, and Researchers in the rapidly emerging IoT ecosystems. © 2022",JOURNAL
47,IST,2022,IST2022,Improving Stack Overflow question title generation with copying enhanced CodeBERT model and bi-modal information,"Context: Stack Overflow is very helpful for software developers who are seeking answers to programming problems. Previous studies have shown that a growing number of questions are of low quality and thus obtain less attention from potential answerers. Gao et al. proposed an LSTM-based model (i.e., BiLSTM-CC) to automatically generate question titles from the code snippets to improve the question quality. However, only using the code snippets in the question body cannot provide sufficient information for title generation, and LSTMs cannot capture the long-range dependencies between tokens. Objective: This paper proposes CCBERT, a deep learning based novel model to enhance the performance of question title generation by making full use of the bi-modal information of the entire question body. Method: CCBERT follows the encoder–decoder paradigm and uses CodeBERT to encode the question body into hidden representations, a stacked Transformer decoder to generate predicted tokens, and an additional copy attention layer to refine the output distribution. Both the encoder and decoder perform the multi-head self-attention operation to better capture the long-range dependencies. This paper builds a dataset containing around 200,000 high-quality questions filtered from the data officially published by Stack Overflow to verify the effectiveness of the CCBERT model. Results: CCBERT outperforms all the baseline models on the dataset. Experiments on both code-only and low-resource datasets show the superiority of CCBERT with less performance degradation. The human evaluation also shows the excellent performance of CCBERT concerning both readability and correlation criteria. Conclusion: CCBERT is capable of automatically capturing the bi-modal semantic information from the entire question body and parsing the long-range dependencies to achieve better performance. Therefore, CCBERT is an effective approach for generating Stack Overflow question titles. © 2022 Elsevier B.V.",JOURNAL
48,SANER,2023,SANER2023,ClawSAT: Towards Both Robust and Accurate Code Models,"We integrate contrastive learning (CL) with adversarial learning to co-optimize the robustness and accuracy of code models. Different from existing works, we show that code obfuscation, a standard code transformation operation, provides novel means to generate complementary 'views' of a code that enable us to achieve both robust and accurate code models. To the best of our knowledge, this is the first systematic study to explore and exploit the robustness and accuracy benefits of (multi-view) code obfuscations in code models. Specifically, we first adopt adversarial codes as robustness-promoting views in CL at the self-supervised pre-training phase. This yields improved robustness and transferability for downstream tasks. Next, at the supervised fine-tuning stage, we show that adversarial training with a proper temporally-staggered schedule of adversarial code generation can further improve robustness and accuracy of the pre-trained code model. Built on the above two modules, we develop ClawSAT, a novel self-supervised learning (SSL) framework for code by integrating CL with adversarial views (Claw) with staggered adversarial training (SAT). On evaluating three downstream tasks across Python and Java, we show that ClawSAT consistently yields the best robustness and accuracy (e.g. 11% in robustness and 6% in accuracy on the code summarization task in Python). We additionally demonstrate the effectiveness of adversarial learning in Claw by analyzing the characteristics of the loss landscape and interpretability of the pre-trained models. Codes are available at https://github.com/OPTML-Group/Claw-SAT. © 2023 IEEE.",CONFERENCE
49,SANER,2023,SANER2023,Slice-Based Code Change Representation Learning,"Code changes are at the very core of software development and maintenance. Deep learning techniques have been used to build a model from a massive number of code changes to solve software engineering tasks, e.g., commit message generation and bug-fix commit identification. However, existing code change representation learning approaches represent code change as lexical tokens or syntactical AST (abstract syntax tree) paths, limiting the capability to learn semantics of code changes. Besides, they mostly do not consider noisy or tangled code change, hurting the accuracy of solved tasks. To address the above problems, we first propose a slice-based code change representation approach which considers data and control dependencies between changed code and unchanged code. Then, we propose a pre-trained sparse Transformer model, named CCS2VEC, to learn code change representations with three pre-training tasks. Our experiments by fine-tuning our pre-trained model on three downstream tasks have demonstrated the improvement of CCS2VEC over the state-of-the-art CC2VEC. © 2023 IEEE.",CONFERENCE
50,SANER,2023,SANER2023,Learning Program Representations with a Tree-Structured Transformer,"Learning vector representations for programs is a critical step in applying deep learning techniques for program understanding tasks. Various neural network models are proposed to learn from tree-structured program representations, e.g., abstract syntax tree (AST) and concrete syntax tree (CST). However, most neural architectures either fail to capture long-range dependencies which are ubiquitous in programs, or cannot learn effective representations for syntax tree nodes, making them incapable of performing the node-level prediction tasks, e.g., bug localization. In this paper, we propose Tree-Transformer, a novel recursive tree-structured neural network to learn the vector representations for source codes. We propose a multi-head attention mechanism to model the dependency between siblings and parent-children node pairs. Moreover, we propose a bi-directional propagation strategy to allow node information passing in two directions, bottom-up and top-down along trees. In this way, Tree-Transformer can learn the information of the node features as well as the global contextual information. The extensive experimental results show that our Tree-Transformer significantly outperforms the existing tree-based and graph-based program representation learning approaches in both the tree-level and node-level prediction tasks. © 2023 IEEE.",CONFERENCE
