PAPER_ID,VENUE,YEAR,FULL_NAME,TITLE,ABSTRACT,TYPE
72,JSS,2023,JSS2023,Diverse title generation for Stack Overflow posts with multiple-sampling-enhanced transforme,"Stack Overflow is one of the most popular programming communities where developers can seek help for their encountered problems. Nevertheless, if inexperienced developers fail to describe their problems clearly, it is hard for them to attract sufficient attention and get the anticipated answers. To address such a problem, we propose M3NSCT5, a novel approach to automatically generate multiple post titles from the given code snippets. Developers may take advantage of the generated titles to find closely related posts and complete their problem descriptions. M3NSCT5 employs the CodeT5 backbone, which is a pre-trained Transformer model with an excellent language understanding and generation ability. To alleviate the ambiguity issue that the same code snippets could be aligned with different titles under varying contexts, we propose the maximal marginal multiple nucleus sampling strategy to generate multiple high-quality and diverse title candidates at a time for the developers to choose from. We build a large-scale dataset with 890,000 question posts covering eight programming languages to validate the effectiveness of M3NSCT5. The automatic evaluation results on the BLEU and ROUGE metrics demonstrate the superiority of M3NSCT5 over six state-of-the-art baseline models. Moreover, a human evaluation with trustworthy results also demonstrates the great potential of our approach for real-world applications. © 2023 Elsevier Inc.",JOURNAL
73,JSS,2023,JSS2023,Optimizing smart contract vulnerability detection via multi-modality code and entropy embedding,"Smart contracts have been widely used in the blockchain world these years, and simultaneously vulnerability detection has gained more and more attention due to the staggering economic losses caused by the attacker. Existing tools that analyze vulnerabilities for smart contracts heavily rely on rules predefined by experts, which are labour-intense and require domain knowledge. Moreover, predefined rules tend to be misconceptions and increase the risk of crafty potential back-doors in the future. Recently, researchers mainly used static and dynamic execution analysis to detect the vulnerabilities of smart contracts and have achieved acceptable results. However, the dynamic method cannot cover all the program inputs and execution paths, which leads to some vulnerabilities that are hard to detect. The static analysis method commonly includes symbolic execution and theorem proving, which requires using constraints to detect vulnerability. These shortcomings show that traditional methods are challenging to apply and expand on a large scale. This paper aims to detect vulnerabilities via the Bug Injection framework and transfer learning techniques. First, we train a Transformer encoder using multi-modality code, which contains source code, intermediate representation, and assembly code. The input code consists separately of Solidity source code, intermediate representation, and assembly code. Specifically, we translate source code into the intermediate representation and decompile the byte code into assembly code by the EVM compiler. Then, we propose a novel entropy embedding technique, which combines token embedding, segment embedding, and positional embedding of the Transformer encoder in our approach. After that, we utilize the Bug Injection framework to automatically generate specific types of buggy code for fine-tuning and evaluating the performance of vulnerability detection. The experimental results show that our proposed approach improves the performance in detecting reentrancy vulnerabilities and timestamp dependence. Moreover, our approach is more flexible and scalable than static and dynamic analysis approaches in detecting smart contract vulnerabilities. Our approach improves the baseline approaches by an average of 11.89% in term of F1 score. © 2023 Elsevier Inc.",JOURNAL
74,JSS,2023,JSS2023,Dialog summarization for software collaborative platform via tuning pre-trained models,"Software collaborative platforms, e.g., Gitter live chat and GitHub Discussions, are essential in software maintenance. Summarizing the live chat logs is useful for extracting, retrieving, and sharing knowledge for software developers. Automatic text summarization has been studied in many areas such as code summarization, and title generation. However, the previous studies rely on rich collected labeled data for model training which are absent for the noisy interleaved dialogs, resulting in poor performance in the few-shot scenario. To tackle the issue, we propose a novel Automatic Dialog Summarization Approach based on pre-trained models, named ADSum. To alleviate the high-cost problem of the from-scratch manual annotation, ADSum finetunes the Text-To-Text Transfer Transformer (T5) model by exploiting the discussion posts on GitHub, and then recommends summaries for an annotator. To solve the poor performance in the few-shot scenario, we propose to employ the prompt tuning paradigm for tuning the T5 model by exploiting the disentangled dialog data on Gitter. Meanwhile, the soft prompt is used to avoid the manual effort of designing appropriate prompt templates. To verify the effectiveness of our approach, we extract 38,964 high-quality discussion posts from GitHub and manually annotate 3,039 dialog summarizations from Gitter. Experimental results show our approach achieves state-of-the-art performance in terms of three performance metrics. In particular, our proposed method outperformed the Transformer-based and other pre-training models by 39% and 14%, respectively, on the GitHub dataset regarding the Rouge-L metric. The experiments of handling data scarcity and a human evaluation also confirm the effectiveness of ADSum. © 2023 Elsevier Inc.",JOURNAL
75,JSS,2023,JSS2023,Towards automated Android app internationalisation: An exploratory study,"Android has become the most popular mobile platform with over 2.5 billion active users who use many different languages across many different countries. In order for Android apps to be useable by all of them, app developers usually need to add an internationalisation feature that adapts the app to the users’ linguistic and cultural requirements. Such a process, including the translation from the default language to up to thousands of languages, is usually achieved via manual efforts and hence is resource-intensive, time-consuming, and error-prone. Automated approaches are hence in demand to help developers mitigate such manual efforts. Since there are millions of apps proposed already for Android users, we are interested in knowing to what extent internationalisation has been supported. Our experimental results show that Android apps, at least the ones released on online markets, have mostly been equipped with internationalisation features, with the number of supported languages varies significantly. By mapping the actual term translations among different languages, we further find that the translations tend to be consistent among different apps, suggesting the possibility to learn from this data to achieve automated app internalisation. To explore this idea we implemented a Transformer-based prototype approach Androi18n, that learns from developers’ practical translations to achieve automated mobile app text translations. Experimental results show that Androi18n is effective in achieving our objective, and its high performance is generic across the translations of different languages. © 2022 Elsevier Inc.",JOURNAL
76,JSS,2023,JSS2023,Efficient transformer with code token learner for code clone detection,"Deep learning techniques have achieved promising results in code clone detection in the past decade. Unfortunately, current deep learning-based methods rarely explicitly consider the modeling of long codes. Worse, the code length is increasing due to the increasing requirement of complex functions. Thus, modeling the relationship between code tokens to catch their long-range dependencies is crucial to comprehensively capture the information of the code fragment. In this work, we resort to the Transformer to capture long-range dependencies within a code, which however requires huge computational cost for long code fragments. To make it possible to apply Transformer efficiently, we propose a code token learner to largely reduce the number of feature tokens in an automatic way. Besides, considering the tree structure of the abstract syntax tree, we present a tree-based position embedding to encode the position of each token in the input. Apart from the Transformer that captures the dependency within a code, we further leverage a cross-code attention module to capture the similarities between two code fragments. Our method significantly reduces the computational cost of using Transformer by 97% while achieves superior performance with state-of-the-art methods. Our code is available at https://github.com/ArcticHare105/Code-Token-Learner. © 2022 Elsevier Inc.",JOURNAL
77,JSS,2023,JSS2023,Boosting source code suggestion with self-supervised Transformer Gated Highway,"Attention-based transformer language models have shown significant performance gains in various natural language tasks. In this work, we explore the impact of transformer language models on the task of source code suggestion. The core intention of this work is to boost the modeling performance for the source code suggestion task and to explore how the training procedures and model architectures impact modeling performance. Additionally, we propose a transformer-based self-supervised learning technique called Transformer Gated Highway that outperforms recurrent and transformer language models of comparable size. The proposed approach combines the Transformer language model with Gated Highway introducing a notion of recurrence. We compare the performance of the proposed approach with transformer-based BERT (CodeTran), RoBERTa (RoBERTaCode), GPT2 (TravTrans), CodeGen and recurrent neural language-based LSTM (CodeLSTM) models. Moreover, we have experimented with various architectural settings for the transformer models to evaluate their impact on modeling performance. The extensive evaluation of the presented approach exhibits better performance on two programming language datasets; Java and C#. Additionally, we have adopted the presented approach for the syntax error correction task to predict the correct syntax token to render its possible implications for other source code modeling tasks. © 2022 Elsevier Inc.",JOURNAL
78,IST,2023,IST2023,Zero-shot learning for requirements classification: An exploratory study,"Context: Requirements engineering (RE) researchers have been experimenting with machine learning (ML) and deep learning (DL) approaches for a range of RE tasks, such as requirements classification, requirements tracing, ambiguity detection, and modelling. However, most of today's ML/DL approaches are based on supervised learning techniques, meaning that they need to be trained using a large amount of task-specific labelled training data. This constraint poses an enormous challenge to RE researchers, as the lack of labelled data makes it difficult for them to fully exploit the benefit of advanced ML/DL technologies. Objective: This paper addresses this problem by showing how a zero-shot learning (ZSL) approach can be used for requirements classification without using any labelled training data. We focus on the classification task because many RE tasks can be framed as classification problems. Methods: The ZSL approach used in our study employs contextual word-embeddings and transformer-based language models (LMs). We demonstrate this approach through a series of experiments to perform three classification tasks: (1) FR/NFR — classification functional requirements vs non-functional requirements; (2) NFR — identification of NFR classes; (3) Security — classification of security vs non-security requirements. Results: The study shows that the ZSL approach achieves an F1 score of 0.66 for the FR/NFR task. For the NFR task, the approach yields F1∼0.72−0.80, considering the most frequent classes. For the Security task, F1 ∼0.66. All of the aforementioned F1 scores are achieved with zero-training efforts. Conclusion: This study demonstrates the potential of ZSL for requirements classification. An important implication is that it is possible to have very little or no training data to perform classification tasks. The proposed approach thus contributes to the solution of the long-standing problem of data shortage in RE. © 2023 The Author(s)",JOURNAL
105,ICSE,2023,ICSE2023,Automating Code Review,"Code reviews are popular in both industrial and open source projects. The benefits of code reviews are widely recognized and include better code quality and lower likelihood of introducing bugs. However, code review comes at the cost of spending developers' time on reviewing their teammates' code. The goal of this research is to investigate the possibility of using Deep Learning (DL) to automate specific code review tasks. We started by training vanilla Transformer models to learn code changes performed by developers during real code review activities. This gives the models the possibility to automatically (i) revise the code submitted for review without any input from the reviewer; and (ii) implement changes required to address a specific reviewer's comment. While the preliminary results were encouraging, in this first work we tested DL models in rather simple code review scenarios, substantially simplifying the targeted problem. This was also due to the choices we made when designing both the technique and the experiments. Thus, in a subsequent work, we exploited a pre-trained Text- To- Text-Transfer-Transformer (T5) to overcome some of these limitations and experiment DL models for code review automation in more realistic and challenging scenarios. The achieved results show the improvements brought by T5 both in terms of applicability (i.e., scenarios in which it can be applied) and performance. Despite this, we are still far from performance levels making these techniques deployable in practice, thus calling for additional research in this area, as we discuss in our future work agenda. © 2023 IEEE.",CONFERENCE
106,ICSE,2023,ICSE2023,Concrat: An Automatic C-to-Rust Lock API Translator for Concurrent Programs,"Concurrent programs suffer from data races. To prevent data races, programmers use locks. However, programs can eliminate data races only when they acquire and release correct locks at correct timing. The lock API of C, in which people have developed a large portion of legacy system programs, does not validate the correct use of locks. On the other hand, Rust, a recently developed system programming language, provides a lock API that guarantees the correct use of locks via type checking. This makes rewriting legacy system programs in Rust a promising way to retrofit safety into them. Unfortunately, manual C-to-Rust translation is extremely laborious due to the discrepancies between their lock APIs. Even the state-of-the-art automatic C-to-Rust translator retains the C lock API, expecting developers to replace them with the Rust lock API. In this work, we propose an automatic tool to replace the C lock API with the Rust lock API. It facilitates C-to-Rust translation of concurrent programs with less human effort than the current practice. Our tool consists of a Rust code transformer that takes a lock summary as an input and a static analyzer that efficiently generates precise lock summaries. We show that the transformer is scalable and widely applicable while preserving the semantics; it transforms 66 KLOC in 2.6 seconds and successfully handles 74% of real-world programs. We also show that the analyzer is scalable and precise; it analyzes 66 KLOC in 4.3 seconds. © 2023 IEEE.",CONFERENCE
107,ICSE,2023,ICSE2023,Personalized action suggestions in low-code automation platforms,"Automation platforms aim to automate repetitive tasks using workflows, which start with a trigger and then perform a series of actions. However, with many possible actions, the user has to search for the desired action at each step, which hinders the speed of flow development. We propose a personalized transformer model that recommends the next item at each step. This personalization is learned end-to-end from user statistics that are available at inference time. We evaluated our model on workflows from Power Automate users and show that personalization improves top-1 accuracy by 22%. For new users, our model performs similar to a model trained without personalization. © 2023 IEEE.",CONFERENCE
108,ICSE,2023,ICSE2023,On the Applicability of Language Models to Block-Based Programs,"Block-based programming languages like Scratch are increasingly popular for programming education and end-user programming. Recent program analyses build on the insight that source code can be modelled using techniques from natural language processing. Many of the regularities of source code that support this approach are due to the syntactic overhead imposed by textual programming languages. This syntactic overhead, however, is precisely what block-based languages remove in order to simplify programming. Consequently, it is unclear how well this modelling approach performs on block-based programming languages. In this paper, we investigate the applicability of language models for the popular block-based programming language Scratch. We model Scratch programs using n-gram models, the most essential type of language model, and transformers, a popular deep learning model. Evaluation on the example tasks of code completion and bug finding confirm that blocks inhibit predictability, but the use of language models is nevertheless feasible. Our findings serve as foundation for improving tooling and analyses for block-based languages. © 2023 IEEE.",CONFERENCE
109,ICSE,2023,ICSE2023,Syntax and Domain Aware Model for Unsupervised Program Translation,"There is growing interest in software migration as the development of software and society. Manually migrating projects between languages is error-prone and expensive. In recent years, researchers have begun to explore automatic program translation using supervised deep learning techniques by learning from large-scale parallel code corpus. However, parallel resources are scarce in the programming language domain, and it is costly to collect bilingual data manually. To address this issue, several unsupervised programming translation systems are proposed. However, these systems still rely on huge monolingual source code to train, which is very expensive. Besides, these models cannot perform well for translating the languages that are not seen during the pre-training procedure. In this paper, we propose SDA-Trans, a syntax and domain-aware model for program translation, which leverages the syntax structure and domain knowledge to enhance the cross-lingual transfer ability. SDA-Trans adopts unsupervised training on a smaller-scale corpus, including Python and Java monolingual programs. The experimental results on function translation tasks between Python, Java, and C++ show that SDA-Trans outperforms many large-scale pre-trained models, especially for unseen language translation. © 2023 IEEE.",CONFERENCE
110,ICSE,2023,ICSE2023,Automated Program Repair in the Era of Large Pre-trained Language Models,"Automated Program Repair (APR) aims to help developers automatically patch software bugs. However, current state-of-the-art traditional and learning-based APR techniques face the problem of limited patch variety, failing to fix complicated bugs. This is mainly due to the reliance on bug-fixing datasets to craft fix templates (traditional) or directly predict potential patches (learning-based). Large Pre-Trained Language Models (LLMs), trained using billions of text/code tokens, can potentially help avoid this issue. Very recently, researchers have directly leveraged LLMs for APR without relying on any bug-fixing datasets. Meanwhile, such existing work either failed to include state-of-the-art LLMs or was not evaluated on realistic datasets. Thus, the true power of modern LLMs on the important APR problem is yet to be revealed. In this work, we perform the first extensive study on directly applying LLMs for APR. We select 9 recent state-of-the-art LLMs, including both generative and infilling models, ranging from 125M to 20B in size. We designed 3 different repair settings to evaluate the different ways we can use LLMs to generate patches: 1) generate the entire patch function, 2) fill in a chunk of code given the prefix and suffix 3) output a single line fix. We apply the LLMs under these repair settings on 5 datasets across 3 different languages and compare different LLMs in the number of bugs fixed, generation speed and compilation rate. We also compare the LLMs against recent state-of-the-art APR tools. Our study demonstrates that directly applying state-of-the-art LLMs can already substantially outperform all existing APR techniques on all our datasets. Among the studied LLMs, the scaling effect exists for APR where larger models tend to achieve better performance. Also, we show for the first time that suffix code after the buggy line (adopted in infilling-style APR) is important in not only generating more fixes but more patches with higher compilation rate. Besides patch generation, the LLMs consider correct patches to be more natural than other ones, and can even be leveraged for effective patch ranking or patch correctness checking. Lastly, we show that LLM-based APR can be further substantially boosted via: 1) increasing the sample size, and 2) incorporating fix template information. © 2023 IEEE.",CONFERENCE
111,ICSE,2023,ICSE2023,CCTEST: Testing and Repairing Code Completion Systems,"Code completion, a highly valuable topic in the software development domain, has been increasingly promoted for use by recent advances in large language models (LLMs). To date, visible LLM-based code completion frameworks such as GitHub Copilot and GPT are trained using deep learning over vast quantities of unstructured text and open source code. As the paramount component and the cornerstone in daily programming tasks, code completion has largely boosted professionals' efficiency in building real-world software systems. In contrast to this flourishing market, we find that code completion systems often output suspicious results, and to date, an automated testing and enhancement framework for code completion systems is not available. This research proposes CCTEST, a framework to test and repair code completion systems in black-box settings. CCTEST features a set of novel mutation strategies, namely program structure-consistent (PSC) mutations, to generate mutated code completion inputs. Then, it detects inconsistent outputs, representing possibly erroneous cases, from all the completed code cases. Moreover, CCTEST repairs the code completion outputs by selecting the output that mostly reflects the 'average' appearance of all output cases, as the final output of the code completion systems. With around 18K test inputs, we detected 33,540 inputs that can trigger erroneous cases (with a true positive rate of 86%) from eight popular LLM-based code completion systems. With repairing, we show that the accuracy of code completion systems is notably increased by 40% and 67% with respect to BLEU score and Levenshtein edit similarity. © 2023 IEEE.",CONFERENCE
112,ICSE,2023,ICSE2023,Explaining Software Bugs Leveraging Code Structures in Neural Machine Translation,"Software bugs claim ˜ 50 % of development time and cost the global economy billions of dollars. Once a bug is reported, the assigned developer attempts to identify and understand the source code responsible for the bug and then corrects the code. Over the last five decades, there has been significant research on automatically finding or correcting software bugs. However, there has been little research on automatically explaining the bugs to the developers, which is essential but a highly challenging task. In this paper, we propose Bugsplainer, a transformer-based generative model, that generates natural language explanations for software bugs by learning from a large corpus of bug-fix commits. Bugsplainer can leverage structural information and buggy patterns from the source code to generate an explanation for a bug. Our evaluation using three performance metrics shows that Bugsplainer can generate understandable and good explanations according to Google's standard, and can outperform multiple baselines from the literature. We also conduct a developer study involving 20 participants where the explanations from Bugsplainer were found to be more accurate, more precise, more concise and more useful than the baselines. © 2023 IEEE.",CONFERENCE
