PAPER_ID,VENUE,YEAR,FULL_NAME,TITLE,ABSTRACT,TYPE
1,ASE,2020,ASE2020,Evaluating Representation Learning of Code Changes for Predicting Patch Correctness in Program Repair,"A large body of the literature of automated program repair develops approaches where patches are generated to be validated against an oracle (e.g., a test suite). Because such an oracle can be imperfect, the generated patches, although validated by the oracle, may actually be incorrect. While the state of the art explore research directions that require dynamic information or that rely on manually-crafted heuristics, we study the benefit of learning code representations in order to learn deep features that may encode the properties of patch correctness. Our empirical work mainly investigates different representation learning approaches for code changes to derive embeddings that are amenable to similarity computations. We report on findings based on embeddings produced by pre-trained and re-trained neural networks. Experimental results demonstrate the potential of embeddings to empower learning algorithms in reasoning about patch correctness: a machine learning predictor with BERT transformer-based embeddings associated with logistic regression yielded an AUC value of about 0.8 in the prediction of patch correctness on a deduplicated dataset of 1000 labeled patches. Our investigations show that learned representations can lead to reasonable performance when comparing against the state-of-the-art, PATCH-SIM, which relies on dynamic information. These representations may further be complementary to features that were carefully (manually) engineered in the literature. © 2020 ACM.",CONFERENCE
2,ASE,2020,ASE2020,Multi-task Learning based Pre-trained Language Model for Code Completion,"Code completion is one of the most useful features in the Integrated Development Environments (IDEs), which can accelerate software development by suggesting the next probable token based on the contextual code in real-time. Recent studies have shown that statistical language modeling techniques can improve the performance of code completion tools through learning from large-scale software repositories. However, these models suffer from two major drawbacks: a) Existing research uses static embeddings, which map a word to the same vector regardless of its context. The differences in the meaning of a token in varying contexts are lost when each token is associated with a single representation; b) Existing language model based code completion models perform poor on completing identifiers, and the type information of the identifiers is ignored in most of these models. To address these challenges, in this paper, we develop a multi-task learning based pre-trained language model for code understanding and code generation with a Transformer-based neural architecture. We pre-train it with hybrid objective functions that incorporate both code understanding and code generation tasks. Then we fine-tune the pre-trained model on code completion. During the completion, our model does not directly predict the next token. Instead, we adopt multi-task learning to predict the token and its type jointly and utilize the predicted type to assist the token prediction. Experiments results on two real-world datasets demonstrate the effectiveness of our model when compared with state-of-the-art methods. © 2020 ACM.",CONFERENCE
3,ICSME,2020,ICSME2020,Sentiment Analysis for Software Engineering: How Far Can Pre-trained Transformer Models Go?,"Extensive research has been conducted on sentiment analysis for software engineering (SA4SE). Researchers have invested much effort in developing customized tools (e.g., SentiStrength-SE, SentiCR) to classify the sentiment polarity for Software Engineering (SE) specific contents (e.g., discussions in Stack Overflow and code review comments). Even so, there is still much room for improvement. Recently, pre-trained Transformer-based models (e.g., BERT, XLNet) have brought considerable breakthroughs in the field of natural language processing (NLP). In this work, we conducted a systematic evaluation of five existing SA4SE tools and variants of four state-of-the-art pre-trained Transformer-based models on six SE datasets. Our work is the first to fine-tune pre-trained Transformer-based models for the SA4SE task. Empirically, across all six datasets, our fine-tuned pre-trained Transformer-based models outperform the existing SA4SE tools by 6.5-35.6% in terms of macro/micro-averaged F1 scores. © 2020 IEEE.",CONFERENCE
4,ESEF_FSE,2020,ESEF_FSE2020,IntelliCode compose: code generation using transformer,In software development through integrated development environments (IDEs)## code completion is one of the most widely used features. Nevertheless## majority of integrated development environments only support completion of methods and APIs## or arguments.  In this paper## we introduce IntelliCode Compose ‚Äì a general-purpose multilingual code completion tool which is capable of predicting sequences of code tokens of arbitrary types## generating up to entire lines of syntactically correct code. It leverages state-of-the-art generative transformer model trained on 1.2 billion lines of source code in Python## C### JavaScript and TypeScript programming languages. IntelliCode Compose is deployed as a cloud-based web service. It makes use of client-side tree-based caching## efficient parallel implementation of the beam search decoder## and compute graph optimizations to meet edit-time completion suggestion requirements in the Visual Studio Code IDE and Azure Notebook.  Our best model yields an average edit similarity of 86.7% and a perplexity of 1.82 for Python programming language.,CONFERENCE
5,ESEF_FSE,2020,ESEF_FSE2020,DeepCommenter: a deep code comment generation tool with hybrid lexical and syntactical information,As the scale of software projects increases## the code comments are more and more important for program comprehension. Unfortunately## many code comments are missing## mismatched or outdated due to tight development schedule or other reasons. Automatic code comment generation is of great help for developers to comprehend source code and reduce their workload. Thus## we propose a code comment generation tool (DeepCommenter) to generate descriptive comments for Java methods. DeepCommenter formulates the comment generation task as a machine translation problem and exploits a deep neural network that combines the lexical and structural information of Java methods. We implement DeepCommenter in the form of an Integrated Development Environment (i.e.## Intellij IDEA) plug-in. Such plug-in is built upon a Client/Server architecture. The client formats the code selected by the user## sends request to the server and inserts the comment generated by the server above the selected code. The server listens for client‚Äôs request## analyzes the requested code using the pre-trained model and sends back the generated comment to the client. The pre-trained model learns both the lexical and syntactical information from source code tokens and Abstract Syntax Trees (AST) respectively and combines these two types of information together to generate comments. To evaluate DeepCommenter## we conduct experiments on a large corpus built from a large number of open source Java projects on GitHub. The experimental results on different metrics show that DeepCommenter outperforms the state-of-the-art approaches by a substantial margin.,CONFERENCE
7,ICSE,2021,ICSE2021,Studying the usage of text-to-text transfer transformer to support code-related tasks,"Deep learning (DL) techniques are gaining more and more attention in the software engineering community. They have been used to support several code-related tasks, such as automatic bug fixing and code comments generation. Recent studies in the Natural Language Processing (NLP) field have shown that the Text-To-Text Transfer Transformer (T5) architecture can achieve state-of-the-art performance for a variety of NLP tasks. The basic idea behind T5 is to first pre-train a model on a large and generic dataset using a self-supervised task (e.g., filling masked words in sentences). Once the model is pre-trained, it is fine-tuned on smaller and specialized datasets, each one related to a specific task (e.g., language translation, sentence classification). In this paper, we empirically investigate how the T5 model performs when pre-trained and fine-tuned to support code-related tasks. We pre-train a T5 model on a dataset composed of natural language English text and source code. Then, we fine-tune such a model by reusing datasets used in four previous works that used DL techniques to: (i) fix bugs, (ii) inject code mutants, (iii) generate assert statements, and (iv) generate code comments. We compared the performance of this single model with the results reported in the four original papers proposing DL-based solutions for those four tasks. We show that our T5 model, exploiting additional data for the self-supervised pre-training phase, can achieve performance improvements over the four baselines. © 2021 IEEE.",CONFERENCE
8,ICSE,2021,ICSE2021,Automated query reformulation for efficient search based on query logs from stack overflow,"As a popular Q&A site for programming, Stack Overflow is a treasure for developers. However, the amount of questions and answers on Stack Overflow make it difficult for developers to efficiently locate the information they are looking for. There are two gaps leading to poor search results: the gap between the user's intention and the textual query, and the semantic gap between the query and the post content. Therefore, developers have to constantly reformulate their queries by correcting misspelled words, adding limitations to certain programming languages or platforms, etc. As query reformulation is tedious for developers, especially for novices, we propose an automated software-specific query reformulation approach based on deep learning. With query logs provided by Stack Overflow, we construct a large-scale query reformulation corpus, including the original queries and corresponding reformulated ones. Our approach trains a Transformer model that can automatically generate candidate reformulated queries when given the user's original query. The evaluation results show that our approach outperforms five state-of-the-art baselines, and achieves a 5.6% to 33.5% boost in terms of ExactMatch and a 4.8% to 14.4% boost in terms of GLEU. © 2021 IEEE.",CONFERENCE
9,ICSE,2021,ICSE2021,PASTA: Synthesizing Object State Transformers for Dynamic Software Updates,"Object transformation (upgrading heap objects to their new-version counterparts) is a crucial step in dynamic software update (DSU). However, providing non-trivial object transformers for complex software updates can be difficult for software developers and upgrade maintainers. This paper presents the design and implementation of PASTA, a tool for automatic object transformer synthesis. © 2021 IEEE.",CONFERENCE
10,ICSE,2021,ICSE2021,Advances in Code Summarization,"Several studies have suggested that comments describing source code can help mitigate the burden of program understanding. However, software systems usually lack adequate comments and even when present, the comments may be obsolete or unhelpful. Researchers have addressed this issue by automatically generating comments from source code, a task referred to as Code Summarization. In this technical presentation, we take a deeper look at some of the significant, recent works in the area of code summarization and how each of them attempts to take a new perspective of this task including methods leveraging RNNs, Transformers, Graph neural networks and Reinforcement learning. © 2021 IEEE.",CONFERENCE
12,ICSE,2022,ICSE2022,Bridging Pre-trained Models and Downstream Tasks for Source Code Understanding,"With the great success of pre-trained models, the pretrain-then-fine tune paradigm has been widely adopted on downstream tasks for source code understanding. However, compared to costly training a large-scale model from scratch, how to effectively adapt pre-trained models to a new task has not been fully explored. In this paper, we propose an approach to bridge pre-trained models and code-related tasks. We exploit semantic-preserving transformation to enrich downstream data diversity, and help pre-trained models learn semantic features invariant to these semantically equivalent transformations. Further, we introduce curriculum learning to or-ganize the transformed data in an easy-to-hard manner to fine-tune existing pre-trained models. We apply our approach to a range of pre-trained models, and they significantly outperform the state-of-the-art models on tasks for source code understanding, such as algorithm classification, code clone detection, and code search. Our experiments even show that without heavy pre-training on code data, natural language pre-trained model RoBERTa fine-tuned with our lightweight approach could outperform or rival existing code pre-trained models fine-tuned on the above tasks, such as CodeBERT and GraphCodeBERT. This finding suggests that there is still much room for improvement in code pre-trained models. © 2022 ACM.",CONFERENCE
13,ICSE,2022,ICSE2022,Jigsaw: Large Language Models meet Program Synthesis,"Large pre-trained language models such as GPT-3 [10], Codex [11], and Coogle's language model [7] are now capable of generating code from natural language specifications of programmer intent. We view these developments with a mixture of optimism and caution. On the optimistic side, such large language models have the potential to improve productivity by providing an automated AI pair programmer for every programmer in the world. On the cautionary side, since these large language models do not understand program semantics, they offer no guarantees about quality of the suggested code. In this paper, we present an approach to augment these large language models with post-processing steps based on program analysis and synthesis techniques, that understand the syntax and semantics of programs. Further, we show that such techniques can make use of user feedback and improve with usage. We present our experiences from building and evaluating such a tool Jigsaw, targeted at synthesizing code for using Python Pandas API using multi-modal inputs. Our experience suggests that as these large language models evolve for synthesizing code from intent, Jigsaw has an important role to play in improving the accuracy of the systems. © 2022 ACM.",CONFERENCE
14,ICSE,2022,ICSE2022,AST-Trans: Code Summarization with Efficient Tree-Structured Attention,"Code summarization aims to generate brief natural language descriptions for source codes. The state-of-the-art approaches follow a transformer-based encoder-decoder architecture. As the source code is highly structured and follows strict grammars, its Abstract Syntax Tree (AST) is widely used for encoding structural information. However, ASTs are much longer than the corresponding source code. Existing approaches ignore the size constraint and simply feed the whole linearized AST into the encoders. We argue that such a simple process makes it difficult to extract the truly useful dependency relations from the overlong input sequence. It also incurs significant computational overhead since each node needs to apply self-attention to all other nodes in the AST. To encode the AST more effectively and efficiently, we propose AST-Trans in this paper which exploits two types of node relationships in the AST: ancestor-descendant and sibling relationships. It applies the tree-structured attention to dynamically allocate weights for relevant nodes and exclude irrelevant nodes based on these two relationships. We further propose an efficient implementation to support fast parallel computation for tree-structure attention. On the two code summarization datasets, experimental results show that AST-Trans significantly outperforms the state-of-the-arts while being times more efficient than standard transformers 11All the codes and data are available at https://github.com/zetang94/ICSE2022_AST_Trans.git. © 2022 ACM.",CONFERENCE
16,ICSE,2022,ICSE2022,FIRA: Fine-Grained Graph-Based Code Change Representation for Automated Commit Message Generation,"Commit messages summarize code changes of each commit in nat-ural language, which help developers understand code changes without digging into detailed implementations and play an essen-tial role in comprehending software evolution. To alleviate human efforts in writing commit messages, researchers have proposed var-ious automated techniques to generate commit messages, including template-based, information retrieval-based, and learning-based techniques. Although promising, previous techniques have limited effectiveness due to their coarse-grained code change representations. This work proposes a novel commit message generation technique, FIRA, which first represents code changes via fine-grained graphs and then learns to generate commit messages automati-cally. Different from previous techniques, FIRA represents the code changes with fine-grained graphs, which explicitly describe the code edit operations between the old version and the new version, and code tokens at different granularities (i.e., sub-tokens and integral tokens). Based on the graph-based representation, FIRA generates commit messages by a generation model, which includes a graph-neural-network-based encoder and a transformer-based decoder. To make both sub-tokens and integral tokens as available ingredients for commit message generation, the decoder is further incorporated with a novel dual copy mechanism. We further per-form an extensive study to evaluate the effectiveness of FIRA. Our quantitative results show that FIRA outperforms state-of-the-art techniques in terms of BLEU, ROUGE-L, and METEOR; and our ablation analysis further shows that major components in our technique both positively contribute to the effectiveness of FIRA. In addition, we further perform a human study to evaluate the quality of generated commit messages from the perspective of developers, and the results consistently show the effectiveness of FIRA over the compared techniques. © 2022 ACM.",CONFERENCE
17,ICSE,2022,ICSE2022,Fast Changeset-based Bug Localization with BERT,"Automatically localizing software bugs to the changesets that induced them has the potential to improve software developer efficiency and to positively affect software quality. To facilitate this automation, a bug report has to be effectively matched with source code changes, even when a significant lexical gap exists between natural language used to describe the bug and identifier naming practices used by developers. To bridge this gap, we need techniques that are able to capture software engineering-specific and project-specific semantics in order to detect relatedness between the two types of documents that goes beyond exact term matching. Popular transformer-based deep learning architectures, such as BERT, excel at leveraging contextual information, hence appear to be a suitable candidate for the task. However, BERT-like models are computationally expensive, which precludes them from being used in an environment where response time is important. In this paper, we describe how BERT can be made fast enough to be applicable to changeset-based bug localization. We also explore several design decisions in using BERT for this purpose, including how best to encode changesets and how to match bug reports to individual changes for improved accuracy. We compare the accuracy and performance of our model to a non-contextual baseline (i.e., vector space model) and BERT-based architectures previously used in software engineering. Our evaluation results demonstrate advantages in using the proposed BERT model compared to the baselines, especially for bug reports that lack any hints about related code elements. © 2022 ACM.",CONFERENCE
18,ICSE,2022,ICSE2022,CodeFill: Multi-token Code Completion by Jointly learning from Structure and Naming Sequences,"Code completion is an essential feature of IDEs, yet current auto-completers are restricted to either grammar-based or NLP-based single token completions. Both approaches have significant draw-backs: grammar-based autocompletion is restricted in dynamically-typed language environments, whereas NLP-based autocompleters struggle to understand the semantics of the programming language and the developer's code context. In this work, we present CodeFill, a language model for autocompletion that combines learned structure and naming information. Using a parallel Transformer architecture and multi-task learning, CodeFill consumes sequences of source code token names and their equivalent AST token types. Uniquely, CodeFill is trained both for single-token and multi-token (statement) prediction, which enables it to learn long-range dependencies among grammatical and naming elements. We train CodeFill on two datasets, consisting of 29M and 425M lines of code, respectively. To make the evaluation more realistic, we develop a method to automatically infer points in the source code at which completion matters. We compare CodeFill against four baselines and two state-of-the-art models, GPT-C and TravTrans+. CodeFill surpasses all baselines in single token prediction (MRR: 70.9% vs. 66.2% and 67.8%) and outperforms the state of the art for multi-token prediction (ROUGE-L: 63.7% vs. 52.4% and 59.2%, for n=4 tokens). We publicly release our source code and datasets. © 2022 ACM.",CONFERENCE
19,ICSE,2022,ICSE2022,TOGA: A Neural Method for Test Oracle Generation,"Testing is widely recognized as an important stage of the software development lifecycle. Effective software testing can provide benefits such as bug finding, preventing regressions, and documentation. In terms of documentation, unit tests express a unit's intended functionality, as conceived by the developer. A test oracle, typically expressed as an condition, documents the intended behavior of a unit under a given test prefix. Synthesizing a functional test oracle is a challenging problem, as it must capture the intended functionality rather than the implemented functionality. In this paper, we propose TOGA (a neural method for Test Oracle GenerAtion), a unified transformer-based neural approach to infer both exceptional and assertion test oracles based on the context of the focal method. Our approach can handle units with ambiguous or missing documentation, and even units with a missing implementation. We evaluate our approach on both oracle inference accuracy and functional bug-finding. Our technique improves accuracy by 33% over existing oracle inference approaches, achieving 96% over-all accuracy on a held out test dataset. Furthermore, we show that when integrated with a automated test generation tool (EvoSuite), our approach finds 57 real world bugs in large-scale Java programs, including 30 bugs that are not found by any other automated testing method in our evaluation. © 2022 ACM.",CONFERENCE
20,ICSE,2022,ICSE2022,SPT-Code: Sequence-to-Sequence Pre-Training for Learning Source Code Representations,"Recent years have seen the successful application of large pretrained models to code representation learning, resulting in substantial improvements on many code-related downstream tasks. But there are issues surrounding their application to SE tasks. First, the majority of the pre-trained models focus on pre-training only the encoder of the Transformer. For generation tasks that are addressed using models with the encoder-decoder architecture, however, there is no reason why the decoder should be left out during pre-training. Second, many existing pre-trained models, including state-of-the-art models such as T5-learning, simply reuse the pretraining tasks designed for natural languages. Moreover, to learn the natural language description of source code needed eventually for code-related tasks such as code summarization, existing pretraining tasks require a bilingual corpus composed of source code and the associated natural language description, which severely limits the amount of data for pre-training. To this end, we propose SPT-Code, a sequence-to-sequence pre-trained model for source code. In order to pre-train SPT-Code in a sequence-to-sequence manner and address the aforementioned weaknesses associated with existing pre-training tasks, we introduce three pre-training tasks that are specifically designed to enable SPT-Code to learn knowledge of source code, the corresponding code structure, as well as a natural language description of the code without relying on any bilingual corpus, and eventually exploit these three sources of information when it is applied to downstream tasks. Experimental results demonstrate that SPT-Code achieves state-of-the-art performance on five code-related downstream tasks after fine-tuning. © 2022 ACM.",CONFERENCE
