PAPER_ID,VENUE,YEAR,FULL_NAME,TITLE,ABSTRACT,TYPE
21,ICSE,2022,ICSE2022,AutoTransform: Automated Code Transformation to Support Modern Code Review Process,"Code review is effective, but human-intensive (e.g., developers need to manually modify source code until it is approved). Recently, prior work proposed a Neural Machine Translation (NMT) approach to automatically transform source code to the version that is reviewed and approved (i.e., the after version). Yet, its performance is still suboptimal when the after version has new identifiers or literals (e.g., renamed variables) or has many code tokens. To address these limitations, we propose AutoTransform which leverages a Byte-Pair Encoding (BPE) approach to handle new tokens and a Transformer-based NMT architecture to handle long sequences. We evaluate our approach based on 14,750 changed methods with and without new tokens for both small and medium sizes. The results show that when generating one candidate for the after version (i.e., beam width = 1), our AUTOTRANSFORM can correctly transform 1,413 changed methods, which is 567% higher than the prior work, highlighting the substantial improvement of our approach for code transformation in the context of code review. This work contributes towards automated code transformation for code reviews, which could help developers reduce their effort in modifying source code during the code review process. © 2022 ACM.",CONFERENCE
22,ICSE,2022,ICSE2022,DeepSTL - From English Requirements to Signal Temporal Logic,"Formal methods provide very powerful tools and techniques for the design and analysis of complex systems. Their practical application remains however limited, due to the widely accepted belief that formal methods require extensive expertise and a steep learning curve. Writing correct formal specifications in form of logical formulas is still considered to be a difficult and error prone task. In this paper we propose DeepSTL, a tool and technique for the translation of informal requirements, given as free English sentences, into Signal Temporal Logic (STL), a formal specification language for cyber-physical systems, used both by academia and advanced research labs in industry. A major challenge to devise such a translator is the lack of publicly available informal requirements and formal specifications. We propose a two-step workflow to address this challenge. We first design a grammar-based generation technique of synthetic data, where each output is a random STL formula and its associated set of possible English translations. In the second step, we use a state-of-the-art transformer-based neural translation technique, to train an accurate attentional translator of English to STL. The experimental results show high translation quality for patterns of English requirements that have been well trained, making this workflow promising to be extended for processing more complex translation tasks. © 2022 ACM.",CONFERENCE
23,ESEM,2022,ESEM2022,MMF3: Neural Code Summarization Based on Multi-Modal Fine-Grained Feature Fusion,"Background: Code summarization automatically generates the corresponding natural language descriptions according to the input code to characterize the function implemented by source code. Comprehensiveness of code representation is critical to code summarization task. However, most existing approaches typically use coarse-grained fusion methods to integrate multi-modal features. They generally represent different modalities of a piece of code, such as an Abstract Syntax Tree (AST) and a token sequence, as two embeddings and then fuse the two ones at the AST/code levels. Such a coarse integration makes it difficult to learn the correlations between fine-grained code elements across modalities effectively. Aims: This study intends to improve the model's prediction performance for high-quality code summarization by accurately aligning and fully fusing semantic and syntactic structure information of source code at node/token levels. Method: This paper proposes a Multi-Modal Fine-grained Feature Fusion approach (MMF3) for neural code summarization. The method uses the Transformer architecture. In particular, we introduce a novel fine-grained fusion method, which allows fine-grained fusion of multiple code modalities at the token and node levels. Specifically, we use this method to fuse information from both token and AST modalities and apply the fused features to code summarization. Results: We conduct experiments on one Java and one Python datasets, and evaluate generated summaries using four metrics. The results show that: 1) the performance of our model outperforms the current stateof-the-art models, and 2) the ablation experiments show that our proposed fine-grained fusion method can effectively improve the accuracy of generated summaries. Conclusion: MMF3 can mine the relationships between cross-modal elements and perform accurate fine-grained element-level alignment fusion accordingly. As a result, more clues can be provided to improve the accuracy of the generated code summaries. © 2022 Association for Computing Machinery.",CONFERENCE
24,ESEC_FSE,2021,ESEC_FSE2021,Empirical study of transformers for source code,"Initially developed for natural language processing (NLP), Transformers are now widely used for source code processing, due to the format similarity between source code and text. In contrast to natural language, source code is strictly structured, i.e., it follows the syntax of the programming language. Several recent works develop Transformer modifications for capturing syntactic information in source code. The drawback of these works is that they do not compare to each other and consider different tasks. In this work, we conduct a thorough empirical study of the capabilities of Transformers to utilize syntactic information in different tasks. We consider three tasks (code completion, function naming and bug fixing) and re-implement different syntax-capturing modifications in a unified framework. We show that Transformers are able to make meaningful predictions based purely on syntactic information and underline the best practices of taking the syntactic information into account for improving the performance of the model. © 2021 Owner/Author.",CONFERENCE
25,ESEC_FSE,2021,ESEC_FSE2021,Domain adaptation for an automated classification of deontic modalities in software engineering contracts,"Contracts are agreements between parties engaging in economic transactions. They specify deontic modalities that the signatories should be held responsible for and state the penalties or actions to be taken if the stated agreements are not met. Additionally, contracts have also been known to be source of Software Engineering (SE) requirements. Identifying the deontic modalities in contracts can therefore add value to the Requirements Engineering (RE) phase of SE. The complex and ambiguous language of contracts make it difficult and time-consuming to identify the deontic modalities (obligations, permissions, prohibitions), embedded in the text. State-of-art neural network models are effective for text classification; however, they require substantial amounts of training data. The availability of contracts data is sparse owing to the confidentiality concerns of customers. In this paper, we leverage the linguistic and taxonomical similarities between regulations (available abundantly in the public domain) and contracts to demonstrate that it is possible to use regulations as training data for classifying deontic modalities in real-life contracts. We discuss the results of a range of experiments from the use of rule-based approach to Bidirectional Encoder Representations from Transformers (BERT) for automating the classification of deontic modalities. With BERT, we obtained an average precision and recall of 90% and 89.66% respectively. © 2021 ACM.",CONFERENCE
26,ASE,2021,ASE2021,Automating User Notice Generation for Smart Contract Functions,"Smart contracts have obtained much attention and are crucial for automatic financial and business transactions. For end-users who have never seen the source code, they can read the user notice shown in end-user client to understand what a transaction does of a smart contract function. However, due to time constraints or lack of motivation, user notice is often missing during the development of smart contracts. For end-users who lack the information of the user notices, there is no easy way for them to check the code semantics of the smart contracts. Thus, in this paper, we propose a new approach SMARTDOC to generate user notice for smart contract functions automatically. Our tool can help end-users better understand the smart contract and aware of the financial risks, improving the users' confidence on the reliability of the smart contracts. SMARTDOC exploits the Transformer to learn the representation of source code and generates natural language descriptions from the learned representation. We also integrate the Pointer mechanism to copy words from the input source code instead of generating words during the prediction process. We extract 7, 878 〈function, notice〉 pairs from 54, 739 smart contracts written in Solidity. Due to the limited amount of collected smart contract functions (i.e., 7, 878 functions), we exploit a transfer learning technique to utilize the learned knowledge to improve the performance of SMARTDOC. The learned knowledge obtained by the pre-training on a corpus of Java code, that has similar characteristics as Solidity code. The experimental results show that our approach can effectively generate user notice given the source code and significantly outperform the state-of-the-art approaches. To investigate human perspectives on our generated user notice, we also conduct a human evaluation and ask participants to score user notice generated by different approaches. Results show that SMARTDOC outperforms baselines from three aspects, naturalness, informativeness, and similarity. © 2021 IEEE.",CONFERENCE
27,ASE,2021,ASE2021,Finding A Needle in a Haystack: Automated Mining of Silent Vulnerability Fixes,"Following the coordinated vulnerability disclosure model, a vulnerability in open source software (OSS) is sug-gested to be fixed ""silently"", without disclosing the fix until the vulnerability is disclosed. Yet, it is crucial for OSS users to be aware of vulnerability fixes as early as possible, as once a vulnerability fix is pushed to the source code repository, a malicious party could probe for the corresponding vulnerability to exploit it. In practice, OSS users often rely on the vulnerability disclosure information from security advisories (e.g., National Vulnerability Database) to sense vulnerability fixes. However, the time between the availability of a vulnerability fix and its disclosure can vary from days to months, and in some cases, even years. Due to manpower constraints and the lack of expert knowledge, it is infeasible for OSS users to manually analyze all code changes for vulnerability fix detection. Therefore, it is essential to identify vulnerability fixes automatically and promptly. In a first-of-its-kind study, we propose VulFixMiner, a Transformer-based approach, capable of automatically extracting semantic meaning from commit-level code changes to identify silent vulnerability fixes. We construct our model using sampled commits from 204 projects, and evaluate using the full set of commits from 52 additional projects. The evaluation results show that VulFixMiner outperforms various state-of-the-art baselines in terms of AUC (i.e., 0.81 and 0.73 on Java and Python dataset, respectively) and two effort-aware performance metrics (i.e., EffortCost, Popt). Especially, with an effort of inspecting 5% of total LOC, VulFixMiner can identify 49% of total vulnerability fixes. Additionally, with manual verification of sampled commits that were identified as vulnerability fixes, but not marked as such in our dataset, we observe that 35% (29 out of 82) of the commits are for fixing vulnerabilities, indicating VulFixMiner is also capable of identifying unreported vulnerability fixes. © 2021 IEEE.",CONFERENCE
29,ICSME,2021,ICSME2021,An Empirical Study on Code Comment Completion,"Code comments play a prominent role in program comprehension activities. However, source code is not always documented and code and comments not always co-evolve. To deal with these issues, researchers have proposed techniques to automatically generate comments documenting a given code at hand. The most recent works in the area applied deep learning (DL) techniques to support such a task. Despite the achieved advances, the empirical evaluations of these approaches show that they are still far from a performance level that would make them valuable for developers. We tackle a simpler and related problem: Code comment completion. Instead of generating a comment for a given code from scratch, we investigate the extent to which state-of-the-art techniques can help developers in writing comments faster. We present a large-scale study in which we empirically assess how a simple n-gram model and the recently proposed Text-To-Text Transfer Transformer (T5) architecture can perform in autocompleting a code comment the developer is typing. The achieved results show the superiority of the T5 model, despite the n-gram model being a competitive solution. © 2021 IEEE.",CONFERENCE
30,ISSTA,2022,ISSTA2022,An extensive study on pre-trained models for program understanding and generation,"Automatic program understanding and generation techniques could significantly advance the productivity of programmers and have been widely studied by academia and industry. Recently, the advent of pre-trained paradigm enlightens researchers to develop general-purpose pre-trained models which can be applied for a broad range of program understanding and generation tasks. Such pre-trained models, derived by self-supervised objectives on large unlabelled corpora, can be fine-tuned in downstream tasks (such as code search and code generation) with minimal adaptations. Although these pre-trained models claim superiority over the prior techniques, they seldom follow equivalent evaluation protocols, e.g., they are hardly evaluated on the identical benchmarks, tasks, or settings. Consequently, there is a pressing need for a comprehensive study of the pre-trained models on their effectiveness, versatility as well as the limitations to provide implications and guidance for the future development in this area. To this end, we first perform an extensive study of eight open-access pre-trained models over a large benchmark on seven representative code tasks to assess their reproducibility. We further compare the pre-trained models and domain-specific state-of-the-art techniques for validating pre-trained effectiveness. At last, we investigate the robustness of the pre-trained models by inspecting their performance variations under adversarial attacks. Through the study, we find that while we can in general replicate the original performance of the pre-trained models on their evaluated tasks and adopted benchmarks, subtle performance fluctuations can refute the findings in their original papers. Moreover, none of the existing pre-trained models can dominate over all other models. We also find that the pre-trained models can significantly outperform non-pre-trained state-of-the-art techniques in program understanding tasks. Furthermore, we perform the first study for natural language-programming language pre-trained model robustness via adversarial attacks and find that a simple random attack approach can easily fool the state-of-the-art pre-trained models and thus incur security issues. At last, we also provide multiple practical guidelines for advancing future research on pre-trained models for program understanding and generation. © 2022 ACM.",CONFERENCE
31,SANER,2022,SANER2022,Aspect-Based API Review Classification: How Far Can Pre-Trained Transformer Model Go?,"APIs (Application Programming Interfaces) are reusable software libraries and are building blocks for modern rapid software development. Previous research shows that programmers frequently share and search for reviews of APIs on the mainstream software question and answer (Q&A) platforms like Stack Overflow, which motivates researchers to design tasks and approaches related to process API reviews automatically. Among these tasks, classifying API reviews into different aspects (e.g., performance or security), which is called the aspect-based API review classification, is of great importance. The current state-of-the-art (SOTA) solution to this task is based on the traditional machine learning algorithm. Inspired by the great success achieved by pre-trained models on many software engineering tasks, this study fine-tunes six pre-trained models for the aspect-based API review classification task and compares them with the current SOTA solution on an API review benchmark collected by Uddin et al. The investigated models include four models (BERT, RoBERTa, ALBERT and XLNet) that are pre-trained on natural languages, BERTOverflow that is pre-trained on text corpus extracted from posts on Stack Overflow, and CosSensBERT that is designed for handling imbalanced data. The results show that all the six fine-tuned models outperform the traditional machine learning-based tool. More specifically, the improvement on the F1-score ranges from 21.0% to 30.2%. We also find that BERTOverflow, a model pre-trained on the corpus from Stack Overflow, does not show better performance than BERT. The result also suggests that CosSensBERT also does not exhibit better performance than BERT in terms of F1, but it is still worthy of being considered as it achieves better performance on MCC and AUC. © 2022 IEEE.",CONFERENCE
32,SANER,2022,SANER2022,SOTitle: A Transformer-based Post Title Generation Approach for Stack Overflow,"On Stack Overflow, developers can not only browse question posts to solve their programming problems but also gain expertise from the question posts to help improve their programming skills. Therefore, improving the quality of question posts in Stack Overflow has attracted the wide attention of researchers. A concise and precise title can play an important role in helping developers understand the key information of the question post, which can improve the post quality. How-ever, the quality of the generated title is not high due to the lack of professional knowledge related to their questions or the poor presentation ability of developers. A previous study aimed to automatically generate the title by analyzing the code snippets in the question post. However, this study ignored the useful information in the corresponding problem description. Therefore, we propose an approach SOTitle for automatic post title generation by leveraging the code snippets and the problem description in the question post (i.e., the multi-modal input). SOTitle follows the Transformer structure, which can effectively capture long-term dependencies through a multi-head attention mechanism. To verify the effectiveness of SOTitle, we construct a large-scale high-quality corpus from Stack Overflow, which includes 1,168,257 high-quality question posts for four popular programming languages. Experimental results show that SOTitle can significantly outperform six state-of-the-art baselines in both automatic evaluation and human evaluation. To encourage follow-up studies, we make our corpus and approach publicly available. © 2022 IEEE.",CONFERENCE
33,SANER,2022,SANER2022,A Simple Retrieval-based Method for Code Comment Generation,"Code comments can effectively help developers comprehend programs. However, it is a challenging and time-consuming task to write good comments for source code. Therefore, automatic generation of code comments is a promising research direction. Recently, researchers have leveraged neural machine translation to generate comments from source code and achieved impressive results. Another line of work has tried to exploit information retrieval (IR) techniques and showed excellent performance improvement on this task. However, current retrieval-based methods usually involve complex retrieval and editing operations, which are difficult to implement. To tackle the problems, we propose kNN-Transformer, a simple end-to-end retrieval-based code comment generation method. Our method combines a simple nearest neighbor retrieval module and a powerful transformer-based model. When generating each token, the retrieval module estimates a probability distribution depending on the current translation context rather than obtaining the retrieved samples in advance. The experiment results on four widely used public datasets (two Java datasets and two Python datasets) demonstrate that our method outperforms all the baselines, and our k NN retrieval module brings significant improvement when similar code snippets are available. © 2022 IEEE.",CONFERENCE
34,SANER,2022,SANER2022,Cross-Language Binary-Source Code Matching with Intermediate Representations,"Binary- source code matching plays an important role in many security and software engineering related tasks such as malware detection, reverse engineering and vulnerability assessment. Currently, several approaches have been proposed for binary-source code matching by jointly learning the embeddings of binary code and source code in a common vector space. Despite much effort, existing approaches target on matching the binary code and source code written in a single programming language. However, in practice, software applications are often written in different programming languages to cater for different requirements and computing platforms. Matching binary and source code across programming languages introduces additional challenges when maintaining multi-language and multi-platform applications. To this end, this paper formulates the problem of cross-language binary-source code matching, and develops a new dataset for this new problem. We present a novel approach XLIR, which is a Transformer-based neural network by learning the intermediate representations for both binary and source code. To validate the effectiveness of XLIR, comprehensive experiments are conducted on two tasks of cross-language binary-source code matching, and cross-language source-source code matching, on top of our curated dataset. Experimental results and analysis show that our proposed XLIR with intermediate representations significantly outperforms other state-of-the-art models in both of the two tasks. © 2022 IEEE.",CONFERENCE
35,MSR,2021,MSR2021,Applying CodeBERT for Automated Program Repair of Java Simple Bugs,"Software debugging, and program repair are among the most time-consuming and labor-intensive tasks in software engineering that would benefit a lot from automation. In this paper, we propose a novel automated program repair approach based on CodeBERT, which is a transformer-based neural architecture pre-trained on large corpus of source code. We fine-tune our model on the ManySStuBs4J small and large datasets to automatically generate the fix codes. The results show that our technique accurately predicts the fixed codes implemented by the developers in 19-72% of the cases, depending on the type of datasets, in less than a second per bug. We also observe that our method can generate varied-length fixes (short and long) and can fix different types of bugs, even if only a few instances of those types of bugs exists in the training dataset. © 2021 IEEE.",CONFERENCE
36,MSR,2022,MSR2022,LineVD: Statement-level Vulnerability Detection using Graph Neural Networks,"Current machine-learning based software vulnerability detection methods are primarily conducted at the function-level. However, a key limitation of these methods is that they do not indicate the specific lines of code contributing to vulnerabilities. This limits the ability of developers to efficiently inspect and interpret the predictions from a learnt model, which is crucial for integrating machine-learning based tools into the software development work-flow. Graph-based models have shown promising performance in function-level vulnerability detection, but their capability for statement-level vulnerability detection has not been extensively explored. While interpreting function-level predictions through explainable AI is one promising direction, we herein consider the statement-level software vulnerability detection task from a fully supervised learning perspective. We propose a novel deep learning framework, LineVD, which formulates statement-level vulnerability detection as a node classification task. LineVD leverages control and data dependencies between statements using graph neural networks, and a transformer-based model to encode the raw source code tokens. In particular, by addressing the conflicting outputs between function-level and statement-level information, LineVD significantly improve the prediction performance without vulnerability status for function code. We have conducted extensive experi-ments against a large-scale collection of real-world C/C++ vulnerabilities obtained from multiple real-world projects, and demonstrate an increase of 105% in F1-score over the current state-of-the-art. © 2022 ACM.",CONFERENCE
